Boek;Hfd;Passage;Titel;Toelichting;Vraag
43;4;Johannes 4:1-12;Levend water ;Niets in dit verhaal lijkt te kloppen. Een rabbi die wegvlucht voor zijn succes? Een vrouw die op het heetst van de dag bij de bron water gaat putten? Een Joodse man die een Samaritaanse vrouw om water vraagt? Samaritanen en Joden spraken niet met elkaar. Deze vrouw werd als zondig gezien. Maar Jezus laat haar merken: ook jij doet ertoe. Jij bent gezien. En ook jij mag bij het koninkrijk van God horen. Ook vrouwen zoals zij biedt Hij het eeuwige leven aan.;Voel jij je door Jezus gezien?
43;4;Johannes 4:1-26;;;
43;4;Johannes 4:13-26;Ontdekking ;Jezus zegt dat Hij levend water aanbiedt, water dat alle dorst stilt en ervoor zorgt dat iemand zelf een bron wordt. Al eerder in de Bijbel komen we de uitdrukking ‘bron van levend water’ tegen, bijvoorbeeld in Jeremia 2:13. Daar heeft het betrekking op God zelf. Jezus zegt dus heel expliciet tegen deze niet-Joodse vrouw dat Hij als God is en  dat Hij de messias is. Ondanks haar geloofsvragen, haar afkomst als Samaritaanse en haar ingewikkelde verleden gelooft ze Hem meteen.;Soms komen mensen van wie je het niet direct zou verwachten tot geloof. Vind je dat een hoopvolle gedachte? Waarom wel of niet?
43;4;Johannes 4:1-42;;Weer vertelt Johannes over een misverstand tussen Jezus en een persoon met wie hij praat. Jezus noemt zichzelf hier iemand die levend water geeft. De Samaritaanse vrouw met wie hij praat, begrijpt niet hoe Jezus het water uit de put kan halen zonder emmer. Maar Jezus heeft het over ware kennis van God. Jezus is degene die God écht kent. En die kennis geeft hij door aan wie het maar wil horen. Niet alleen aan de Joden, maar ook aan de Samaritanen. De Samaritaanse vrouw noemt Jezus eerst een profeet en komt daarna tot de conclusie dat Jezus de messias is. Door wat zij aan anderen vertelt, gaan nog veel meer Samaritanen in Jezus geloven, schrijft Johannes. Zo is deze anonieme Samaritaanse vrouw hét voorbeeld van de ideale gelovige, en laat ze bovendien zien dat Jezus ook voor niet-Joden gekomen is.;Waar vindt je water dat eeuwig leven geeft?
43;4;Johannes 4:27-42;Onverwacht geloof ;De vrouw die zich eerst zo schaamde dat zij op het heetst van de dag water ging putten laat haar kruik staan en rent terug naar de stad om iedereen te vertellen over Jezus. Daar in Samaria komen de mensen die voor de Joden er niet bij hoorden massaal tot geloof in Jezus. Voor de leerlingen moet dit een verbazingwekkend moment zijn geweest. Altijd hebben zij gehoord dat Samaritanen verkeerd geloofden en God op de verkeerde plek aanbeden. Maar nu laat Jezus zien dat het koninkrijk ook voor hen is bedoeld.;Aan wie wil jij vertellen over wat Jezus in jouw leven heeft gedaan?
43;4;Johannes 4:43-54;Geneeskrachtig ;De hoveling laat zien dat hij gelooft dat Jezus zijn zoon kan genezen. Anders zou hij het niet aan Hem vragen, toch? Toch staat er in de tekst dat hij pas echt ging geloven toen hij wist dat zijn zoon daadwerkelijk genezen was door het woord van Jezus. ‘Eerst zien, dan geloven’, luidt het spreekwoord. Door zijn getuigenis van de ontmoeting met Jezus gingen ook al zijn huisgenoten geloven.;Hoe is dat voor jou? Geloof jij, nog voordat je het hebt gezien, dat God wonderlijke dingen in jouw leven kan doen?
43;4;Johannes 4:5-30;;In het Johannes-evangelie lees je vaak over misverstanden: Jezus zegt iets over de geestelijke werkelijkheid, en zijn luisteraars vatten dat heel letterlijk op. Dat gebeurt ook in deze tekst. Jezus noemt zichzelf hier iemand die levend water geeft. De Samaritaanse vrouw met wie Hij praat, begrijpt niet hoe Jezus het water uit de put kan halen zonder emmer. Jezus heeft het echter niet over water in de letterlijke zin, maar over ware kennis van God. Jezus is degene die God écht kent. En die kennis geeft Hij door aan wie het maar wil horen. Niet alleen aan de Joden, maar ook aan de Samaritanen. Anders dan gewoon water kan dit levende water onbeperkt worden uitgedeeld. En wie ervan drinkt – wie door Jezus God leert kennen – vindt niet alleen antwoorden op zijn of haar vragen, maar eeuwig leven.;Met wie zou jij het levende water willen delen?
43;5;Johannes 4:43-5:23;;Doordat Jezus mensen op een wonderbaarlijke manier geneest, trekt hij de aandacht. Als Jezus uitlegt waarom hij ook op de sabbat werkt, noemt hij God ‘mijn Vader’. Volgens sommige toehoorders zegt Jezus daarmee dat hij gelijk is aan God, en dat keuren ze af. Maar daar trekt Jezus zich niets van aan. Hij noemt zichzelf ‘de Zoon’. Zo laat hij duidelijk zien hoe intiem de band is tussen God en hem. En daar laat Jezus het niet bij. Hij zegt dat hij niets uit zichzelf kan doen, maar dat hij alleen kan doen wat hij de Vader ziet doen (vers 19). Door deze woorden van Jezus wordt nog eens extra duidelijk dat een keuze voor Jezus, een keuze voor God is. Want Jezus weet precies wat God wil, doet precies wat God wil en verdient dan ook de eer waar God recht op heeft.;Hoe is of was de band tussen je en jouw ouders?
43;5;Johannes 5:1-13;Beweging en bewogenheid ;De man is al achtendertig jaar ziek en hoopt op een wonder. Waarom zou hij anders bij het wonderlijke water liggen? Toch vraagt Jezus: ‘Wilt u gezond worden?’ Zou de man het nodig hebben dat Jezus dit aan hem vraagt? Wat zou hij gaan doen als hij weer beter zou worden? Het water komt dan wel niet in beweging, Jezus is wel bewogen en geneest de man. En meteen na zijn genezing gaat de man naar de tempel.;Wat zou jij doen als je na een lange tijd van beperkingen weer vrij was om te doen wat je wilt?
43;5;Johannes 5:14-29;Is Jezus God? ;De verwarring en het ongeloof van de Joden zijn begrijpelijk. Jezus zegt dat Hij als zijn Vader is, en dat zijn Vader altijd werkt. Maar de sabbat is gebaseerd op het rusten van God na de schepping. Jezus rust niet op de sabbat, Hij doet juist wonderen! En Hij zegt dat Hij alleen doet wat Hij zijn Vader ziet doen. Het zijn nogal radicale uitspraken! Ook belooft Jezus dat wie in Hem gelooft eeuwig leeft. Niet alleen door Hem, maar door wat zijn Vader doet.;Hoe stel jij je de relatie tussen God de Vader en zijn Zoon Jezus voor?
43;5;Johannes 5:30-47;;"In de tekst van vandaag gaat de discussie tussen Jezus en de Joodse leiders door. Die discussie was begonnen omdat Jezus op sabbat dingen deed die volgens de leiders op die dag niet zijn toegestaan. Maar al snel gaat het om algemenere vragen: Wat voor macht heeft Jezus? En wie heeft die macht aan hem gegeven? Jezus’ antwoord kun je heel kort samenvatten: Hij is de ‘Mensenzoon’ (vers 27, lees ook nog eens Johannes 3:13). Deze titel komt uit Daniël 7:13-14. Daar gaat het over iemand die van God de macht krijgt
over alle volken op aarde. Over die macht heeft Jezus het ook in Johannes 5. Zijn gezag komt van God, en zijn oordeel komt overeen met Gods wil. Zijn woorden en daden zijn niet in strijd met de Joodse heilige schriften, maar vervullen die juist.";Kijkt je uit naar de tijd dat de doden zullen opstaan?
43;5;Johannes 5:31-40;Getuigenis ;Volgens het Oude Testament is een gebeurtenis waarheid als er minstens twee getuigen zijn om het te vertellen (zie bijvoorbeeld Deuteronomium 17:2-5). Johannes is een van die getuigen. Hij noemde Jezus ‘het lam van God dat de zonden van de wereld wegneemt’ (Johannes 1:29). Ook de wonderen die Jezus doet met Gods hulp getuigen van Jezus’ afkomst. Jezus is door God gezonden. God wordt zichtbaar door Jezus.;Welke andere bewijzen en welke andere getuigen kun je nu nog vinden die laten zien dat Jezus de Zoon van God is?
43;5;Johannes 5:41-47;Het belang van Schriftstudie ;Eeuwig leven krijg je niet door veel kennis op te doen over God uit de Schrift of door de wet van Mozes letter voor letter na te leven. De wet verwijst naar Jezus: Hij is het lam dat de zonden wegneemt en Hij is gezonden door een liefdevolle God die een nieuw verbond met mensen wil aangaan. Eeuwig leven krijg je dus door te geloven in Jezus en door het liefhebben van God. Dat geeft leven. De Bijbel wijst naar Gods plan en liefde. Door de Bijbel te lezen leer je Gods hart beter kennen.;Welke bijbeltekst over Gods liefde vind jij mooi?
43;6;Johannes 6:1-15;Brood en water;Het verhaal over de wonderbare spijziging lezen we in alle vier de evangeliën, maar alleen in Johannes lezen we de reactie van de mensen (vers 14). De mensen begrijpen dat Jezus de beloofde profeet is die op Mozes lijkt (Deuteronomium 18:15). De mensen verwachtten dat deze profeet, de messias over wie geschreven staat in joodse heilige boeken (bijvoorbeeld Micha 5:1 en Zacharia 9:9), koning zou zijn van Israël en de hele wereld.;Waarom zou Jezus toch weglopen? De mensen hadden het toch begrepen? Of niet helemaal? Waarom niet?
43;6;Johannes 6:1-24;;"Na het wonder waarbij Jezus duizenden mensen te eten geeft van vijf broden en twee vissen, willen de mensen hem tot koning uitroepen. Maar Jezus trekt zich terug. Ook hier draait het weer om de vraag: Wie is Jezus? En dus ook: Wie is hij niet? Jezus heeft
net nog uitgelegd dat hij als Mensenzoon alle macht heeft. Maar hij wil niet met geweld regeren. Hij wil geen koning zijn op de manier die de mensen van hem verwachten. Dat de mensen hem een koning vinden, maakt wel duidelijk hoe erg ze onder de indruk zijn van zijn wondertekenen. Ook wanneer hij over het meer van Galilea loopt, laat Jezus zijn macht zien. Lopen over het wilde water is iets dat alleen God kan: Hij ‘wandelt op de hoog oprijzende zee’ (Job 9:8). Zo benadrukt Johannes steeds weer hoe Jezus de Zoon op God de Vader lijkt.";Waarom denk je dat Jezus zich terugtrekt na dit wonder?
43;6;Johannes 6:16-29;Waterloop;Jezus loopt over het water. Waar gebeurd of niet? Gisteren lazen we over de wonderbare spijziging. Ook zo’n verhaal waarvan veel mensen denken dat het niet echt gebeurd kan zijn. Toch begrepen de mensen die erbij waren dat er iets wonderlijks gebeurd was. En nadat Jezus is weggegaan en met zijn leerlingen uiteindelijk samen aan de overkant van het meer aan land komt, gaan de mensen de volgende dag weer achter Hem aan. Zij zoeken Jezus juist om dat wonder, zij zoeken Hem omdat ze met eigen ogen zagen dat het echt gebeurde!;Wat denk jij: waar gebeurd of niet? En wat betekent dat voor wat dit verhaal volgens jou te zeggen heeft?
43;6;Johannes 6:24-51;;Jezus is in de synagoge van Kafarnaüm. Een dag eerder heeft Hij vijfduizend mensen te eten gegeven van vijf broden. Maar gewoon brood, legt Hij nu uit, verdwijnt als je het opeet. Daarom kun je beter op zoek gaan naar hemels brood. Het ware brood uit de hemel, waarvan het manna dat de Israëlieten in de woestijn ontvingen een voorafschaduwing vormde, is Jezus zelf. Sommige aanwezigen in de synagoge protesteren: ‘Hij is toch Jezus, de zoon van Jozef? We weten precies wie zijn vader en moeder zijn. Hoe kan Hij dan beweren dat Hij uit de hemel gekomen is?’ Hun verwarring is begrijpelijk. Jezus’ aardse afkomst lijkt niet te kloppen met zijn uitspraak dat Hij uit de hemel komt. Toch benadrukt Jezus opnieuw dat Hij bij God vandaan komt. Daarna maakt Hij nog iets duidelijk over het beeld van het brood. Niet alleen is Hij zelf het hemelse brood, maar tegelijk is Hij degene die dat brood aan de mensen uitdeelt. Want het brood staat voor zijn lichaam. Jezus zal zijn eigen lichaam, zijn eigen leven, opgeven om de mensen te redden.;Neem je binnenkort deel aan een avondmaals- of eucharistieviering? Denk dan nog eens terug aan deze tekst.
43;6;Johannes 6:25-36;Het echte brood ;De mensen waren onder de indruk van Jezus, ze dachten zelfs te begrijpen wie Hij was: de beloofde profeet. Maar ze begrepen het niet! Het ging niet om het brood dat ze aten, zoals het volk manna at in de woestijn. Het gaat erom dat ze zien en geloven dat Jezus de messias is die door God gestuurd is. Net zoals het manna in de woestijn niet door Mozes gestuurd was, maar door God. Jezus wil dat de mensen begrijpen: het is God die Hem, het levende brood, stuurt om hen te redden zoals het manna het volk in de woestijn redde.;Jezus noemt zichzelf het levende brood. Welk beeld roept dat bij je op?
43;6;Johannes 6:25-71;;Gisteren lazen we dat Jezus iedereen op een wonderbaarlijke manier te eten gaf. Het thema ‘voedsel’ komt in de tekst van vandaag terug. De letterlijke en figuurlijke betekenis wisselen elkaar daarbij steeds af. Via het manna van de woestijntocht komen we bij het brood dat van God komt en leven geeft. Dat brood willen Jezus’ toehoorders graag hebben. Maar dan doet Jezus voor het eerst een ‘Ik ben’-uitspraak: ‘Ik ben het brood dat leven geeft’ (vers 35, 48 en 51). Hij verwijst hiermee naar zijn dood en naar de maaltijd die daaraan herinnert. Maar hij zegt ook: ‘Als je bij mij hoort en jezelf voedt met mijn woorden, word je gered.’ Maar, zoals wel vaker in het Johannes-evangelie, begrijpen de mensen Jezus eerst niet. Ze voeden zich liever met ‘echt’ brood dan met de woorden van Jezus, op Petrus na dan.;Wat vindt je van de woorden van Petrus in vers 68-69?
43;6;Johannes 6:30-40;Het echte brood;De mensen waren onder de indruk van Jezus, ze dachten zelfs te begrijpen wie Hij was: de beloofde profeet. Maar ze begrepen het niet! Het ging niet om het brood dat ze aten, zoals het volk manna at in de woestijn. Het gaat erom dat ze zien en geloven dat Jezus de messias is die door God gestuurd is. Net zoals het manna in de woestijn niet door Mozes gestuurd was, maar door God. Jezus wil dat de mensen begrijpen: het is God die Hem, het levende brood, stuurt om hen te redden zoals het manna het volk in de woestijn redde.;Jezus noemt zichzelf het levende brood. Welk beeld roept dat bij je op?
43;6;Johannes 6:37-46;Discussie ;Dat Jezus een bijzondere man was, dat geloofden de mensen wel – zeker nadat ze de wonderbare spijziging de dag ervoor hadden meegemaakt. Maar nu beweert Jezus dat Hij door God gestuurd is en uit de hemel komt. Dat kunnen ze niet geloven. Maar Jezus maakt korte metten met de discussie. God, die Hem heeft gestuurd, legt ook het geloof in Jezus in de harten van mensen. Zoals Jeremia al zei in Jeremia 31:33-34: iedereen zal God kennen en dat is iets wat God in hun binnenste zal leggen. Daarmee legt Jezus de bezwaren naast zich neer.;Wat denk jij: kun je zelf kiezen om in Jezus te geloven of moet je dat geloof van God ontvangen?
43;6;Johannes 6:41-59;Harde woorden?;Jezus zegt tegen de mensen dat ze zijn lichaam moeten eten en zijn bloed moeten drinken. Dat is toch te absurd voor woorden? In het evangelie van Johannes lezen we wel vaker dat de mensen helemaal niet begrijpen wat Jezus met zijn woorden bedoelt. Jezus’ lichaam is als brood, niet gewoon brood, maar brood dat eeuwig leven geeft. Dat brood is nog specialer dan het manna dat God vroeger in de woestijn gaf (Deuteronomium 8:3). Jezus zegt: ‘Mijn dood brengt redding. Als je dat gelooft, dan is het alsof je mijn lichaam eet’ (vers 56, BGT). En dan hoor je voor altijd bij Jezus.;Wat betekent het eten van het brood bij het avondmaal voor jou?
43;6;Johannes 6:60-68;Scheiding;"De reactie op de woorden van Jezus is divers. Veel mensen gaan weg, ze geloven ze niet. Jezus zegt tegen zijn leerlingen: ‘Willen jullie soms ook weggaan?’ Het klinkt bijna als een voorstel.
Het antwoord van Petrus is in de wij-vorm. Hij spreekt namens de anderen: ‘Naar wie zouden we moeten gaan, Heer? U spreekt woorden die eeuwig leven geven’ (vers 68). En hoewel hij dit namens de anderen uitspreekt, kriebelt het bij één van hen. Judas houdt het niet uit. Hij houdt het niet uit bij de dingen die Jezus zegt en leert. En omdat hij het met die woorden niet uithoudt, verlaat hij de sociale kring van de leerlingen. Tijdens een gezamenlijke maaltijd vertrekt hij. Zijn einde is eenzaam. Ver van God, ver van zijn vrienden.";Soms brengt Gods woord scheiding tussen mensen. Heb je dat wel eens meegemaakt? Hoe zou je kunnen reageren?
43;6;Johannes 6:60-71;Scheiding ;De evangelist Johannes schrijft in een tijd waarin er veel strijd was binnen de kerk, ook over de vraag wie Jezus is: waarlijk mens en waarlijk God? Dat Jezus hier beweert dat Hij door God gestuurd is en het levend brood is, maakt de spanning duidelijk. Jezus’ woorden leiden tot een splitsing onder de mensen die Hem volgen. Zijn woorden gaan te ver, vinden de meeste volgelingen. Alleen de twaalf leerlingen blijven bij Hem. En Petrus belijdt: ‘U spreekt woorden die eeuwig leven geven. Wij geloven en weten dat U de heilige van God bent.’;De leerlingen blijven bij Jezus omdat zijn woorden eeuwig leven geven. Met wie praat jij over wat echt belangrijk is?
43;7;Johannes 7:1-13;PR-strategie ;Jezus wordt steeds bekender, maar de vraag blijft: wie is Hij eigenlijk? Hoe bekender iemand is, hoe meer meningen er over hem zijn. In Jeruzalem heeft iedereen het over Jezus. Is Hij een goed mens of een bedrieger? Moet Hij uit de weg geruimd worden? Komt Hij van God? Iedereen lijkt een mening te hebben. Zo ook de broers van Jezus. Zij denken dat Jezus al die dingen doet om bekend te worden. Ze zien (nog) niet wie Hij is. Jezus doet wat Hij God ziet doen (dat zegt Hij in Johannes 5:19), niet voor zijn eigen bekendheid maar voor Gods eer.;Als iemand jou zou vragen wie Jezus is, wat zou je dan zeggen?
43;7;Johannes 7:1-24;;Tijdens het Loofhuttenfeest gaat Jezus in het geheim naar Jeruzalem. Opvallend genoeg houdt hij zich daarna toch niet stil. Hij gaat juist naar de drukste plek van de stad, de tempel. Daar geeft hij les. We horen niet waarover Jezus lesgeeft, maar wel dat de mensen onder de indruk zijn van zijn woorden. Tegelijkertijd zijn ze een beetje achterdochtig: Jezus heeft geen officiële opleiding gehad – hoe betrouwbaar kan zijn onderwijs dan zijn? Volgens Jezus is het antwoord op die vraag niet zo moeilijk: hij geeft niet zijn eigen lessen door, maar die van God de Vader. Wie God kent en volgens zijn wil probeert te leven, zal ontdekken dat de boodschap van Jezus van God de Vader komt. Maar wie God niet kent en alleen maar letterlijk kijkt naar wat er in de wet staat, zal, ironisch genoeg, denken dat Jezus door zijn woorden spot met God.;Wat is volgens je de verhouding tussen ‘wat God wil’ (vers 17) en ‘de wet’ (vers 19)?
43;7;Johannes 7:14-24;Wijsheid van boven ;Ondanks de dreiging gaat Jezus naar het Loofhuttenfeest in Jeruzalem. Tijdens dit zevendaagse feest wordt herdacht dat het volk Israël na de bevrijding uit Egypte in tenten verbleef, op weg naar het beloofde land. Halverwege het feest geeft Jezus in de tempel uitleg over God en de wet van Mozes. Het gaat niet zozeer om de wet, maar om de bedoeling erachter: leven in verbondenheid met God. Gods verbond met het volk Israël begon al bij Abraham, en niet pas met de wet van Mozes. De wet is dus niet het belangrijkste, maar het verbond met God.;Welke feesten vier jij om je verbondenheid met God te vieren?
43;7;Johannes 7:25-36;Tijd en plaats ;De mensen zijn zoekend en onzeker: is Jezus de messias die zou komen, of toch niet? Ze bespreken met elkaar wat waar zou kunnen zijn. Ze luisteren naar Jezus’ onderwijs. Met anderen denken ze na over wat ze weten over de messias uit de Bijbel. En ze kijken naar wat hun religieuze leiders doen en geloven. Zo proberen de mensen te ontdekken wie Jezus is.;Wat doe jij als je iets niet zeker weet of iets moeilijk te geloven vindt? Vraag jij bijvoorbeeld mensen om raad, kijk je naar de (kerkelijke) leiders of ga je in de Bijbel op onderzoek uit?
43;7;Johannes 7:25-53;;Al vroeg in het Johannes-evangelie spreekt Jezus over zijn naderende dood. Hij zal gaan naar een plek waar niemand hem kan vinden. Daarna spreekt Jezus over de komst van de heilige Geest (lees ook eens Jesaja 55:1). Door alle uitspraken van Jezus raken de mensen in de war. Sommigen zoeken steeds naar een letterlijke betekenis, maar kunnen die niet vinden. Anderen vinden Jezus’ woorden niet kloppen met wat er in hun heilige boeken staat. De mensen zijn het niet met elkaar eens over wie Jezus dan is. Volgens sommigen kan hij niet de beloofde messias zijn, omdat hij uit Galilea komt. Anderen worden enthousiast door zijn woorden en daden. En de leiders van het volk willen Jezus gevangennemen. Juist zij vinden het ongelooflijk moeilijk om te zien wie Jezus werkelijk is.;Waarom geloven in dit verhaal de mensen wel of niet in Jezus? Herkent je daar iets van?
43;7;Johannes 7:37-52;Wie is Jezus? ;Jezus heeft allemaal dingen gezegd waar de mensen nog niet zoveel van begrijpen. Naar welke plaats gaat Hij? Wat bedoelt Hij precies? Omdat Jezus het heeft over dingen die nog gaan gebeuren, snapt bijna niemand waar Hij het over heeft. Pas later, na zijn dood, opstanding en hemelvaart, pas als de heilige Geest is gekomen begrijpen mensen wat Jezus bedoelde. Op dit feest levert het vooral verwarring op. Opvallend is dat farizeeër Nikodemus hier genoemd wordt. Ook hij zit vol vragen (zie ook Johannes 3), maar hij wil Jezus wel een eerlijke kans geven zodat hij misschien zelf nog tot de ontdekking komt wie Jezus werkelijk is.;Welke woorden van Jezus begreep je vroeger niet, maar nu wel?
43;8;Johannes 7:53-8:11;Zandschrift ;Het is een bekend verhaal, de religieuze leiders brengen een overspelige vrouw bij Jezus. Jezus’ woorden zijn bekend geworden: ‘Wie zonder zonde is…’ In dit verhaal is dat de enige keer dat Jezus tegen de leiders spreekt. Veel opvallender is Jezus’ zwijgen en schrijven in het zand, tot twee keer toe. We weten niet wat Hij schreef, maar Hij gebruikt zijn (wijs)vinger om iets te schrijven of tekenen – de vinger die de farizeeën gebruiken om naar iemand te wijzen en die persoon te beschuldigen. Maar Jezus wijst naar niemand. En pas als iedereen weg is, spreekt Jezus over wat echt belangrijk is: ‘Ik veroordeel je niet.’;Wat betekenen deze woorden van Jezus voor jou?
43;8;Johannes 8:1-11;;De farizeeën en schriftgeleerden brengen een vrouw bij Jezus die met een andere man geslapen heeft. Ze vragen aan Jezus wat er met haar moet gebeuren. Jezus lijkt eerst niet op hun vraag te reageren. Hij schrijft in het zand. Een opvallend detail! Vaak willen mensen weten wat Jezus toen schreef. Maar met die vraag kom je niet verder, want dat wordt gewoon niet verteld. Wel wordt herhaald dát hij op de grond schrijft. Het gaat er dus niet om wát hij schrijft, maar dát hij schrijft. En wel: met zijn vinger. Er is in de Bijbel nog één ander iemand die iets schrijft met zijn vinger (Exodus 31:18 en Deuteronomium 9:10): God zelf. Weer laat Johannes zien dat Jezus en de Vader één en dezelfde zijn in wat zij doen.;Over welke mensen heb je snel jouw oordeel klaar?
43;8;Johannes 8:12-20;Getuigenis ;In het Johannes-evangelie doet Jezus verschillende keren een ‘Ik ben’- uitspraak. Al die uitspraken doen denken aan de naam van God: ‘Ik ben’ (Exodus 3:14). Johannes benadrukt op deze manier de eenheid tussen God de Vader en Jezus de Zoon. In het verhaal van vandaag zegt Jezus: ‘Ik ben het licht voor de wereld.’ Jezus zegt deze woorden vlak na het Loofhuttenfeest, waarbij de Israëlieten vierden dat God als een licht voor hen uit ging tijdens de woestijnreis (Exodus 13:21-22). De leiders vonden het heel belangrijk dit moment in hun geschiedenis te vieren. Maar Jezus laat tijdens het feest steeds merken dat het niet om het feest gaat, maar om datgene waar het naar verwijst: leven in verbondenheid met God.;Welk feest vind jij belangrijk en waarom?
43;8;Johannes 8:12-30;;Jezus gaat weer in gesprek met de farizeeën, die willen weten wie hij nu precies is. Dit is, zoals inmiddels wel duidelijk is geworden, een van de belangrijkste vragen in het Johannesevangelie. Er worden verschillende antwoorden op gegeven. In dit gedeelte is dat antwoord: ‘Ik ben het licht voor de wereld.’ Dat Jezus het licht is, hebben we ook al gezien aan het begin van het evangelie. Ook daar speelt licht een belangrijke rol. Een ander antwoord op deze vraag volgt straks in hoofdstuk 10: ‘Ik ben de goede herder.’ In deze uitspraken zie je steeds weer de verbondenheid tussen Jezus en God, en tussen Jezus en mensen. Maar in plaats van dat Jezus’ woorden over zichzelf zorgen voor duidelijkheid of herkenning, zorgen ze bij de mensen om hem heen vooral voor verwarring.;Voelt je ook weleens verwarring als het gaat over Jezus?
43;8;Johannes 8:21-36;Bevrijdende waarheid ;Zoals wel vaker in het Johannes-evangelie, begrijpen de mensen niet wat Jezus bedoelt. Telkens als Jezus iets over zichzelf zegt wat de mensen niet begrijpen, probeert Hij hun iets te leren over wie Hij is en wat voor bijzondere relatie Hij met God heeft. Uiteindelijk zegt Jezus in vers 29 heel duidelijk waar het om gaat: Hij is gestuurd door God en Hij hoort bij Hem. Geloven in Jezus’ boodschap is belangrijker dan je achtergrond, of je nu van Abraham afstamt of niet. Door in Jezus te geloven leer je de waarheid kennen en mag je, net als Jezus, voor altijd bij God horen.;Wat is waarheid volgens jou?
43;8;Johannes 8:30-36;;Gedurende zijn tijd op de aarde vertelt Jezus onvermoeibaar over het koninkrijk van God. Hij doet wonderen en geeft onderwijs aan iedereen die het wil horen. Veel Joden komen tot geloof in Hem. Jezus zegt tegen hen dat de waarheid hen zal bevrijden. Die opmerking valt niet in goede aarde. Ze zijn toch nooit iemands slaaf geweest? Een merkwaardige reactie: de afstammelingen van Abraham waren slaven geweest in Egypte, en in de tijd van Jezus heersten de Romeinen over hun land. Maar waarschijnlijk begrijpen ze dat het om een ander soort bevrijding gaat. Dat klopt. Jezus geeft aan dat ze bevrijd zullen worden van de zonde. Hoe ingrijpend en mensonwaardig slavernij is, daarvan zijn we ons in deze tijd steeds meer bewust. Dat Jezus juist dit beeld gebruikt voor de macht van de zonde, onderstreept hoeveel invloed zonde op een mensenleven kan hebben, en wat een opluchting het kan zijn om ervan bevrijd te worden.;Wanneer voel jij je werkelijk vrij?
